{
  "schema_version": 1,
  "record_id": "audit-fixture-001",
  "timestamp": "2026-08-29T09:01:00Z",
  "entrypoint": "cli",
  "command_id": "command-fixture-001",
  "trace_id": "trace-fixture-001",
  "project_id": "project-fixture-001",
  "run_id": "run-fixture-001",
  "action": "pipeline.run",
  "outcome": "succeeded",
  "actor": {"type": "local-user", "id": "fixture-user"},
  "details": {"policy": "auto"}
}
